C:\Users\kotka>mysql -u root -p;
mysql: [Warning] Using a password on the command line interface can be insecure.
ERROR 1045 (28000): Access denied for user 'root'@'localhost' (using password: YES)

C:\Users\kotka>mysql -u root -p
Enter password: **********
Welcome to the MySQL monitor.  Commands end with ; or \g.
Your MySQL connection id is 18
Server version: 8.0.45 MySQL Community Server - GPL

Copyright (c) 2000, 2026, Oracle and/or its affiliates.

Oracle is a registered trademark of Oracle Corporation and/or its
affiliates. Other names may be trademarks of their respective
owners.

Type 'help;' or '\h' for help. Type '\c' to clear the current input statement.

mysql> create database mysql_practice_and_training;
Query OK, 1 row affected (0.01 sec)

mysql> show databases;
+-----------------------------+
| Database                    |
+-----------------------------+
| information_schema          |
| mysql                       |
| mysql_practice_and_training |
| performance_schema          |
| sys                         |
+-----------------------------+
5 rows in set (0.01 sec)

mysql> use mysql_practice_and_training;
Database changed
mysql> create table Students(int id(10), name varchar(200), age int(5));
ERROR 1064 (42000): You have an error in your SQL syntax; check the manual that corresponds to your MySQL server version for the right syntax to use near 'int id(10), name varchar(200), age int(5))' at line 1
mysql> create table Students(id int(10), name varchar(200), age int(5));
Query OK, 0 rows affected, 2 warnings (0.05 sec)

mysql> desc Students;
+-------+--------------+------+-----+---------+-------+
| Field | Type         | Null | Key | Default | Extra |
+-------+--------------+------+-----+---------+-------+
| id    | int          | YES  |     | NULL    |       |
| name  | varchar(200) | YES  |     | NULL    |       |
| age   | int          | YES  |     | NULL    |       |
+-------+--------------+------+-----+---------+-------+
3 rows in set (0.01 sec)

mysql> alter table Students add (class varchar(100));
Query OK, 0 rows affected (0.10 sec)
Records: 0  Duplicates: 0  Warnings: 0

mysql> desc Students;
+-------+--------------+------+-----+---------+-------+
| Field | Type         | Null | Key | Default | Extra |
+-------+--------------+------+-----+---------+-------+
| id    | int          | YES  |     | NULL    |       |
| name  | varchar(200) | YES  |     | NULL    |       |
| age   | int          | YES  |     | NULL    |       |
| class | varchar(100) | YES  |     | NULL    |       |
+-------+--------------+------+-----+---------+-------+
4 rows in set (0.00 sec)

mysql> insert into Students values(1, 'abc', 18, '11th');
Query OK, 1 row affected (0.01 sec)

mysql> select * from Students;
+------+------+------+-------+
| id   | name | age  | class |
+------+------+------+-------+
|    1 | abc  |   18 | 11th  |
+------+------+------+-------+
1 row in set (0.01 sec)

mysql> insert into Students values(2, 'mno', 17, '11th');
Query OK, 1 row affected (0.01 sec)

mysql> insert into Students values(2, 'mno', 17, '11th'),(3, 'pqr', 18, '11th'),(4, 'xyz', 18, '11th'),(5, 'asdf', 18, '11th'),(6, 'mhd', 17, '11th'),(7, 'ytf', 17, '11th'),(8, 'ghj', 18, '11th'),(9, 'mjgf', 17, '11th'),(10, 'mno', 18, '11th');
Query OK, 9 rows affected (0.01 sec)
Records: 9  Duplicates: 0  Warnings: 0

mysql> select * from Students;
+------+------+------+-------+
| id   | name | age  | class |
+------+------+------+-------+
|    1 | abc  |   18 | 11th  |
|    2 | mno  |   17 | 11th  |
|    2 | mno  |   17 | 11th  |
|    3 | pqr  |   18 | 11th  |
|    4 | xyz  |   18 | 11th  |
|    5 | asdf |   18 | 11th  |
|    6 | mhd  |   17 | 11th  |
|    7 | ytf  |   17 | 11th  |
|    8 | ghj  |   18 | 11th  |
|    9 | mjgf |   17 | 11th  |
|   10 | mno  |   18 | 11th  |
+------+------+------+-------+
11 rows in set (0.00 sec)

mysql> select age from Students;
+------+
| age  |
+------+
|   18 |
|   17 |
|   17 |
|   18 |
|   18 |
|   18 |
|   17 |
|   17 |
|   18 |
|   17 |
|   18 |
+------+
11 rows in set (0.00 sec)

mysql> select id, name from Students;
+------+------+
| id   | name |
+------+------+
|    1 | abc  |
|    2 | mno  |
|    2 | mno  |
|    3 | pqr  |
|    4 | xyz  |
|    5 | asdf |
|    6 | mhd  |
|    7 | ytf  |
|    8 | ghj  |
|    9 | mjgf |
|   10 | mno  |
+------+------+
11 rows in set (0.00 sec)

mysql> alter table Students add percentage decimal(5,2);
Query OK, 0 rows affected (0.04 sec)
Records: 0  Duplicates: 0  Warnings: 0

mysql> desc Students;
+------------+--------------+------+-----+---------+-------+
| Field      | Type         | Null | Key | Default | Extra |
+------------+--------------+------+-----+---------+-------+
| id         | int          | YES  |     | NULL    |       |
| name       | varchar(200) | YES  |     | NULL    |       |
| age        | int          | YES  |     | NULL    |       |
| class      | varchar(100) | YES  |     | NULL    |       |
| percentage | decimal(5,2) | YES  |     | NULL    |       |
+------------+--------------+------+-----+---------+-------+
5 rows in set (0.00 sec)

mysql> update Students set percentage = 85.50 where id = 1;
Query OK, 1 row affected (0.01 sec)
Rows matched: 1  Changed: 1  Warnings: 0

mysql> select * from Students;
+------+------+------+-------+------------+
| id   | name | age  | class | percentage |
+------+------+------+-------+------------+
|    1 | abc  |   18 | 11th  |      85.50 |
|    2 | mno  |   17 | 11th  |       NULL |
|    2 | mno  |   17 | 11th  |       NULL |
|    3 | pqr  |   18 | 11th  |       NULL |
|    4 | xyz  |   18 | 11th  |       NULL |
|    5 | asdf |   18 | 11th  |       NULL |
|    6 | mhd  |   17 | 11th  |       NULL |
|    7 | ytf  |   17 | 11th  |       NULL |
|    8 | ghj  |   18 | 11th  |       NULL |
|    9 | mjgf |   17 | 11th  |       NULL |
|   10 | mno  |   18 | 11th  |       NULL |
+------+------+------+-------+------------+
11 rows in set (0.00 sec)

mysql> update Students set percentage = 75.5 where id = 2;
Query OK, 2 rows affected (0.01 sec)
Rows matched: 2  Changed: 2  Warnings: 0

mysql> update Students set percentage = 78 where id = 3;
Query OK, 1 row affected (0.01 sec)
Rows matched: 1  Changed: 1  Warnings: 0

mysql> update Students set percentage = 72.3 where id = 4;
Query OK, 1 row affected (0.01 sec)
Rows matched: 1  Changed: 1  Warnings: 0

mysql> update Students set percentage = 70.4 where id = 5;
Query OK, 1 row affected (0.01 sec)
Rows matched: 1  Changed: 1  Warnings: 0

mysql> update Students set percentage = 65 where id = 6;
Query OK, 1 row affected (0.01 sec)
Rows matched: 1  Changed: 1  Warnings: 0

mysql> update Students set percentage = 80 where id = 7;
Query OK, 1 row affected (0.01 sec)
Rows matched: 1  Changed: 1  Warnings: 0

mysql> update Students set percentage = 77.8 where id = 8;
Query OK, 1 row affected (0.01 sec)
Rows matched: 1  Changed: 1  Warnings: 0

mysql> update Students set percentage = 84.67 where id = 9;
Query OK, 1 row affected (0.01 sec)
Rows matched: 1  Changed: 1  Warnings: 0

mysql> update Students set percentage = 85.1 where id = 10;
Query OK, 1 row affected (0.01 sec)
Rows matched: 1  Changed: 1  Warnings: 0

mysql> select * from Students;
+------+------+------+-------+------------+
| id   | name | age  | class | percentage |
+------+------+------+-------+------------+
|    1 | abc  |   18 | 11th  |      85.50 |
|    2 | mno  |   17 | 11th  |      75.50 |
|    2 | mno  |   17 | 11th  |      75.50 |
|    3 | pqr  |   18 | 11th  |      78.00 |
|    4 | xyz  |   18 | 11th  |      72.30 |
|    5 | asdf |   18 | 11th  |      70.40 |
|    6 | mhd  |   17 | 11th  |      65.00 |
|    7 | ytf  |   17 | 11th  |      80.00 |
|    8 | ghj  |   18 | 11th  |      77.80 |
|    9 | mjgf |   17 | 11th  |      84.67 |
|   10 | mno  |   18 | 11th  |      85.10 |
+------+------+------+-------+------------+
11 rows in set (0.00 sec)

mysql> update Students set percentage = 66.45 where id = 6;
Query OK, 1 row affected (0.01 sec)
Rows matched: 1  Changed: 1  Warnings: 0

mysql> select * from Students;
+------+------+------+-------+------------+
| id   | name | age  | class | percentage |
+------+------+------+-------+------------+
|    1 | abc  |   18 | 11th  |      85.50 |
|    2 | mno  |   17 | 11th  |      75.50 |
|    2 | mno  |   17 | 11th  |      75.50 |
|    3 | pqr  |   18 | 11th  |      78.00 |
|    4 | xyz  |   18 | 11th  |      72.30 |
|    5 | asdf |   18 | 11th  |      70.40 |
|    6 | mhd  |   17 | 11th  |      66.45 |
|    7 | ytf  |   17 | 11th  |      80.00 |
|    8 | ghj  |   18 | 11th  |      77.80 |
|    9 | mjgf |   17 | 11th  |      84.67 |
|   10 | mno  |   18 | 11th  |      85.10 |
+------+------+------+-------+------------+
11 rows in set (0.00 sec)

mysql>